{"accepted":true,"case_count":10,"cases":[{"attack_id":"route_hint_expected_candidate_hash","reason":"SchemaValidationError:SCHEMA_MALFORMED at route_hints.expected_candidate_hash_present: forbidden host route hint","rejected":true,"schema_id":"runtime.v4.phase14.attack_result.v1"},{"attack_id":"heldout_challenge_leakage","reason":"SchemaValidationError:SCHEMA_MALFORMED at phase14.program.heldout_material_visible: held-out access is forbidden","rejected":true,"schema_id":"runtime.v4.phase14.attack_result.v1"},{"attack_id":"manual_repair_marker","reason":"SchemaValidationError:SCHEMA_MALFORMED at phase14.program.manual_repair_count: manual repair is forbidden","rejected":true,"schema_id":"runtime.v4.phase14.attack_result.v1"},{"attack_id":"update_family_forgery","reason":"SchemaValidationError:SCHEMA_MALFORMED at phase14.program.update_kinds: update kinds do not match the selected family","rejected":true,"schema_id":"runtime.v4.phase14.attack_result.v1"},{"attack_id":"rejection_history_pointer_forgery","reason":"SchemaValidationError:SCHEMA_MALFORMED at phase14.history.active_package_hash_after: rejection must preserve the active package","rejected":true,"schema_id":"runtime.v4.phase14.attack_result.v1"},{"attack_id":"private_answer_store_substitution","reason":"SchemaValidationError:SCHEMA_MALFORMED at phase14.answer_store.answers[0]: challenge commitment mismatch","rejected":true,"schema_id":"runtime.v4.phase14.attack_result.v1"},{"attack_id":"proposal_worker_private_source_access","reason":"private challenge source dependency absent","rejected":true,"schema_id":"runtime.v4.phase14.attack_result.v1"},{"attack_id":"direct_route_marker_forgery","reason":"SchemaValidationError:SCHEMA_MALFORMED at phase14.program.route_marker_token_id: direct and recovery programs must target the certified M4 route marker","rejected":true,"schema_id":"runtime.v4.phase14.attack_result.v1"},{"attack_id":"probe_route_marker_forgery","reason":"SchemaValidationError:SCHEMA_MALFORMED at phase14.program.route_marker_token_id: probe programs must retain the unsolved commitment slot","rejected":true,"schema_id":"runtime.v4.phase14.attack_result.v1"},{"attack_id":"post_freeze_candidate_mutation","reason":"SchemaValidationError:SCHEMA_MALFORMED at phase14.candidate: payload_tree_hash_mismatch","rejected":true,"schema_id":"runtime.v4.phase14.attack_result.v1"}],"report_hash":"89c176b6c5e846c545b370d8c7371c8f6eeb04acd24ffa0fa5a1f2716ecd9156","schema_id":"runtime.v4.phase14.attack_suite.v1"}